{
  "id": "thermostat",
  "title": "Heating schedule",
  "description": "Weekly heating or cooling setpoints.",
  "week": "top",
  "value": {
    "week": {
      "mon": [
        {
          "time": "06:30",
          "model": "comfort"
        },
        {
          "time": "08:30",
          "model": "eco"
        },
        {
          "time": "17:30",
          "model": "comfort"
        },
        {
          "time": "22:30",
          "model": "eco"
        }
      ],
      "tue": [
        {
          "time": "06:30",
          "model": "comfort"
        },
        {
          "time": "08:30",
          "model": "eco"
        },
        {
          "time": "17:30",
          "model": "comfort"
        },
        {
          "time": "22:30",
          "model": "eco"
        }
      ],
      "wed": [
        {
          "time": "06:30",
          "model": "comfort"
        },
        {
          "time": "08:30",
          "model": "eco"
        },
        {
          "time": "17:30",
          "model": "comfort"
        },
        {
          "time": "22:30",
          "model": "eco"
        }
      ],
      "thu": [
        {
          "time": "06:30",
          "model": "comfort"
        },
        {
          "time": "08:30",
          "model": "eco"
        },
        {
          "time": "17:30",
          "model": "comfort"
        },
        {
          "time": "22:30",
          "model": "eco"
        }
      ],
      "fri": [
        {
          "time": "06:30",
          "model": "comfort"
        },
        {
          "time": "08:30",
          "model": "eco"
        },
        {
          "time": "17:30",
          "model": "comfort"
        },
        {
          "time": "22:30",
          "model": "eco"
        }
      ],
      "sat": [
        {
          "time": "06:30",
          "model": "comfort"
        },
        {
          "time": "22:30",
          "model": "eco"
        }
      ],
      "sun": [
        {
          "time": "06:30",
          "model": "comfort"
        },
        {
          "time": "22:30",
          "model": "eco"
        }
      ]
    }
  },
  "models": [
    {
      "id": "away",
      "label": "Away",
      "icon": "🧳",
      "preview": "#8aa1b1",
      "defaults": {
        "temp": 15
      },
      "summary": "{temp} °C"
    },
    {
      "id": "eco",
      "label": "Eco",
      "icon": "🌿",
      "preview": "#6d8fd6",
      "defaults": {
        "temp": 17
      },
      "summary": "{temp} °C"
    },
    {
      "id": "comfort",
      "label": "Comfort",
      "icon": "🛋️",
      "preview": "#e59a4b",
      "defaults": {
        "temp": 21
      },
      "summary": "{temp} °C"
    },
    {
      "id": "boost",
      "label": "Boost",
      "icon": "🔥",
      "preview": "#e5533b",
      "defaults": {
        "temp": 24
      },
      "summary": "{temp} °C"
    },
    {
      "id": "manual",
      "label": "Manual",
      "icon": "🌡️",
      "previewScale": {
        "field": "temp",
        "min": 5,
        "max": 30,
        "from": "#6d8fd6",
        "to": "#e5533b"
      },
      "defaults": {
        "temp": 20
      },
      "summary": "{temp}",
      "fields": [
        {
          "key": "temp",
          "type": "range",
          "min": 5,
          "max": 30,
          "step": 0.5,
          "unit": " °C",
          "default": 20,
          "label": "Setpoint"
        }
      ]
    }
  ],
  "presets": [
    {
      "id": "office",
      "label": "Office",
      "slots": [
        {
          "time": "06:30",
          "model": "comfort"
        },
        {
          "time": "08:30",
          "model": "eco"
        },
        {
          "time": "17:30",
          "model": "comfort"
        },
        {
          "time": "22:30",
          "model": "eco"
        }
      ]
    },
    {
      "id": "home",
      "label": "Home all day",
      "slots": [
        {
          "time": "06:30",
          "model": "comfort"
        },
        {
          "time": "22:30",
          "model": "eco"
        }
      ]
    },
    {
      "id": "holiday",
      "label": "Holiday",
      "slots": [
        {
          "time": "00:00",
          "model": "away"
        }
      ]
    }
  ],
  "messages": {
    "en": {
      "model.away": "Away",
      "model.eco": "Eco",
      "model.comfort": "Comfort",
      "model.boost": "Boost",
      "model.manual": "Manual",
      "field.temp": "Setpoint",
      "preset.office": "Office",
      "preset.home": "Home all day",
      "preset.holiday": "Holiday",
      "title": "Heating schedule"
    },
    "it": {
      "model.away": "Assente",
      "model.eco": "Eco",
      "model.comfort": "Comfort",
      "model.boost": "Boost",
      "model.manual": "Manuale",
      "field.temp": "Temperatura",
      "preset.office": "Ufficio",
      "preset.home": "A casa tutto il giorno",
      "preset.holiday": "Vacanza",
      "title": "Programma riscaldamento"
    }
  }
}
